{
  "packet_id": "pkt_00000c",
  "created_at": "2026-01-01T00:00:00.000Z",
  "applicant": {
    "applicant_id": "app_00000d",
    "full_name": "Quinn Nguyen",
    "preferred_contact_method": "sms",
    "language_preference": "bn"
  },
  "household": {
    "household_id": "hh_00000e",
    "members": [
      {
        "member_id": "mem_000009",
        "relationship": "self",
        "age_band": "adult"
      },
      {
        "member_id": "mem_00000a",
        "relationship": "child",
        "age_band": "minor"
      },
      {
        "member_id": "mem_00000b",
        "relationship": "parent",
        "age_band": "senior"
      }
    ],
    "income_sources": [
      {
        "source_id": "inc_00000f",
        "source_type": "employment",
        "annualized_amount": 55539
      }
    ]
  },
  "opportunity": {
    "opportunity_id": "opp_00000g",
    "program_type": "lihtc",
    "unit_size": "1br"
  },
  "consent_grants": [
    {
      "grant_id": "grant_00000h",
      "grantee": "reference-housing-operator",
      "purpose": "eligibility_review",
      "granted_at": "2026-01-01T00:00:00.000Z"
    }
  ],
  "documents": [
    {
      "document_id": "doc_00000i",
      "document_type": "income_verification",
      "status": "provided"
    }
  ]
}